{"capture_mode":"roomplan_mesh","capture_session_id":"0f936474-e29d-415d-9691-b52faed6227b","configuration_ref":"session/capture-configuration.json","coordinate_space_id":"893addc6-b4b6-4cb4-8da2-67c64765ffa5","schema":"htdt.capture.session","schema_version":"1.0.0","started_at":"2026-10-01T01:00:00Z","timing_ref":"session/timing.json"}